[
  {
    "watchlist_id": "WL-VEH-000001",
    "registration_number": "7IA4E",
    "normalized_registration_number": "7IA4E",
    "category": "DEMO_MISSING_VEHICLE",
    "priority": "LOW",
    "status": "ACTIVE",
    "entity_type": "vehicle",
    "source": "SYNTHETIC_DEMO",
    "synthetic": true,
    "description": "Synthetic demonstration record (Target: Step 7 Observed Match)",
    "notes": "Configured to match actual observed vehicle in CCTV network",
    "created_at": "2026-09-14T13:32:17.293836+00:00",
    "updated_at": "2026-09-14T13:32:17.293836+00:00"
  },
  {
    "watchlist_id": "WL-VEH-000002",
    "registration_number": "TMS32P",
    "normalized_registration_number": "TMS32P",
    "category": "DEMO_VEHICLE_OF_INTEREST",
    "priority": "HIGH",
    "status": "ACTIVE",
    "entity_type": "vehicle",
    "source": "SYNTHETIC_DEMO",
    "synthetic": true,
    "description": "Synthetic demonstration record (Target: Step 7 Observed Match)",
    "notes": "Configured to match actual observed vehicle in CCTV network",
    "created_at": "2026-09-14T13:32:17.293836+00:00",
    "updated_at": "2026-09-14T13:32:17.293836+00:00"
  },
  {
    "watchlist_id": "WL-VEH-000003",
    "registration_number": "JEETMS32",
    "normalized_registration_number": "JEETMS32",
    "category": "DEMO_BLACKLISTED_VEHICLE",
    "priority": "LOW",
    "status": "ACTIVE",
    "entity_type": "vehicle",
    "source": "SYNTHETIC_DEMO",
    "synthetic": true,
    "description": "Synthetic demonstration record (Target: Step 7 Observed Match)",
    "notes": "Configured to match actual observed vehicle in CCTV network",
    "created_at": "2026-09-14T13:32:17.293836+00:00",
    "updated_at": "2026-09-14T13:32:17.293836+00:00"
  },
  {
    "watchlist_id": "WL-VEH-000004",
    "registration_number": "SODH",
    "normalized_registration_number": "SODH",
    "category": "DEMO_STOLEN_VEHICLE",
    "priority": "MEDIUM",
    "status": "ACTIVE",
    "entity_type": "vehicle",
    "source": "SYNTHETIC_DEMO",
    "synthetic": true,
    "description": "Synthetic demonstration record (Target: Step 7 Observed Match)",
    "notes": "Configured to match actual observed vehicle in CCTV network",
    "created_at": "2026-09-14T13:32:17.293836+00:00",
    "updated_at": "2026-09-14T13:32:17.293836+00:00"
  },
  {
    "watchlist_id": "WL-VEH-000005",
    "registration_number": "J3EGECSITMS3",
    "normalized_registration_number": "J3EGECSITMS3",
    "category": "DEMO_VEHICLE_OF_INTEREST",
    "priority": "LOW",
    "status": "ACTIVE",
    "entity_type": "vehicle",
    "source": "SYNTHETIC_DEMO",
    "synthetic": true,
    "description": "Synthetic demonstration record (Target: Step 7 Observed Match)",
    "notes": "Configured to match actual observed vehicle in CCTV network",
    "created_at": "2026-09-14T13:32:17.293836+00:00",
    "updated_at": "2026-09-14T13:32:17.293836+00:00"
  },
  {
    "watchlist_id": "WL-VEH-000006",
    "registration_number": "CHMBHBIC",
    "normalized_registration_number": "CHMBHBIC",
    "category": "DEMO_BLACKLISTED_VEHICLE",
    "priority": "LOW",
    "status": "ACTIVE",
    "entity_type": "vehicle",
    "source": "SYNTHETIC_DEMO",
    "synthetic": true,
    "description": "Synthetic demonstration record (Target: Step 7 Observed Match)",
    "notes": "Configured to match actual observed vehicle in CCTV network",
    "created_at": "2026-09-14T13:32:17.293836+00:00",
    "updated_at": "2026-09-14T13:32:17.293836+00:00"
  },
  {
    "watchlist_id": "WL-VEH-000007",
    "registration_number": "CH1BHBG",
    "normalized_registration_number": "CH1BHBG",
    "category": "DEMO_MISSING_VEHICLE",
    "priority": "HIGH",
    "status": "ACTIVE",
    "entity_type": "vehicle",
    "source": "SYNTHETIC_DEMO",
    "synthetic": true,
    "description": "Synthetic demonstration record (Target: Step 7 Observed Match)",
    "notes": "Configured to match actual observed vehicle in CCTV network",
    "created_at": "2026-09-14T13:32:17.293836+00:00",
    "updated_at": "2026-09-14T13:32:17.293836+00:00"
  },
  {
    "watchlist_id": "WL-VEH-000008",
    "registration_number": "SODHE",
    "normalized_registration_number": "SODHE",
    "category": "DEMO_MISSING_VEHICLE",
    "priority": "HIGH",
    "status": "ACTIVE",
    "entity_type": "vehicle",
    "source": "SYNTHETIC_DEMO",
    "synthetic": true,
    "description": "Synthetic demonstration record (Target: Step 7 Observed Match)",
    "notes": "Configured to match actual observed vehicle in CCTV network",
    "created_at": "2026-09-14T13:32:17.293836+00:00",
    "updated_at": "2026-09-14T13:32:17.293836+00:00"
  },
  {
    "watchlist_id": "WL-VEH-000009",
    "registration_number": "CHMBH",
    "normalized_registration_number": "CHMBH",
    "category": "DEMO_BLACKLISTED_VEHICLE",
    "priority": "HIGH",
    "status": "ACTIVE",
    "entity_type": "vehicle",
    "source": "SYNTHETIC_DEMO",
    "synthetic": true,
    "description": "Synthetic demonstration record (Target: Step 7 Observed Match)",
    "notes": "Configured to match actual observed vehicle in CCTV network",
    "created_at": "2026-09-14T13:32:17.293836+00:00",
    "updated_at": "2026-09-14T13:32:17.293836+00:00"
  },
  {
    "watchlist_id": "WL-VEH-000010",
    "registration_number": "TMS32",
    "normalized_registration_number": "TMS32",
    "category": "DEMO_VEHICLE_OF_INTEREST",
    "priority": "MEDIUM",
    "status": "ACTIVE",
    "entity_type": "vehicle",
    "source": "SYNTHETIC_DEMO",
    "synthetic": true,
    "description": "Synthetic demonstration record (Target: Step 7 Observed Match)",
    "notes": "Configured to match actual observed vehicle in CCTV network",
    "created_at": "2026-09-14T13:32:17.293836+00:00",
    "updated_at": "2026-09-14T13:32:17.293836+00:00"
  },
  {
    "watchlist_id": "WL-VEH-000011",
    "registration_number": "DL05XY3803",
    "normalized_registration_number": "DL05XY3803",
    "category": "DEMO_BLACKLISTED_VEHICLE",
    "priority": "MEDIUM",
    "status": "INACTIVE",
    "entity_type": "vehicle",
    "source": "SYNTHETIC_DEMO",
    "synthetic": true,
    "description": "Synthetic demonstration record (Target: Non-Matching Control)",
    "notes": "Configured to demonstrate negative lookup case (unobserved vehicle)",
    "created_at": "2026-09-14T13:32:17.293836+00:00",
    "updated_at": "2026-09-14T13:32:17.293836+00:00"
  },
  {
    "watchlist_id": "WL-VEH-000012",
    "registration_number": "RJ25GH4598",
    "normalized_registration_number": "RJ25GH4598",
    "category": "DEMO_VEHICLE_OF_INTEREST",
    "priority": "LOW",
    "status": "ACTIVE",
    "entity_type": "vehicle",
    "source": "SYNTHETIC_DEMO",
    "synthetic": true,
    "description": "Synthetic demonstration record (Target: Non-Matching Control)",
    "notes": "Configured to demonstrate negative lookup case (unobserved vehicle)",
    "created_at": "2026-09-14T13:32:17.293836+00:00",
    "updated_at": "2026-09-14T13:32:17.293836+00:00"
  },
  {
    "watchlist_id": "WL-VEH-000013",
    "registration_number": "MH03JK7572",
    "normalized_registration_number": "MH03JK7572",
    "category": "DEMO_VEHICLE_OF_INTEREST",
    "priority": "LOW",
    "status": "ACTIVE",
    "entity_type": "vehicle",
    "source": "SYNTHETIC_DEMO",
    "synthetic": true,
    "description": "Synthetic demonstration record (Target: Non-Matching Control)",
    "notes": "Configured to demonstrate negative lookup case (unobserved vehicle)",
    "created_at": "2026-09-14T13:32:17.293836+00:00",
    "updated_at": "2026-09-14T13:32:17.293836+00:00"
  },
  {
    "watchlist_id": "WL-VEH-000014",
    "registration_number": "MH37JK4483",
    "normalized_registration_number": "MH37JK4483",
    "category": "DEMO_MISSING_VEHICLE",
    "priority": "CRITICAL",
    "status": "ACTIVE",
    "entity_type": "vehicle",
    "source": "SYNTHETIC_DEMO",
    "synthetic": true,
    "description": "Synthetic demonstration record (Target: Non-Matching Control)",
    "notes": "Configured to demonstrate negative lookup case (unobserved vehicle)",
    "created_at": "2026-09-14T13:32:17.293836+00:00",
    "updated_at": "2026-09-14T13:32:17.293836+00:00"
  },
  {
    "watchlist_id": "WL-VEH-000015",
    "registration_number": "RJ10GH3287",
    "normalized_registration_number": "RJ10GH3287",
    "category": "DEMO_BLACKLISTED_VEHICLE",
    "priority": "HIGH",
    "status": "ACTIVE",
    "entity_type": "vehicle",
    "source": "SYNTHETIC_DEMO",
    "synthetic": true,
    "description": "Synthetic demonstration record (Target: Non-Matching Control)",
    "notes": "Configured to demonstrate negative lookup case (unobserved vehicle)",
    "created_at": "2026-09-14T13:32:17.294996+00:00",
    "updated_at": "2026-09-14T13:32:17.294996+00:00"
  },
  {
    "watchlist_id": "WL-VEH-000016",
    "registration_number": "MP28XY7543",
    "normalized_registration_number": "MP28XY7543",
    "category": "DEMO_VEHICLE_OF_INTEREST",
    "priority": "MEDIUM",
    "status": "ACTIVE",
    "entity_type": "vehicle",
    "source": "SYNTHETIC_DEMO",
    "synthetic": true,
    "description": "Synthetic demonstration record (Target: Non-Matching Control)",
    "notes": "Configured to demonstrate negative lookup case (unobserved vehicle)",
    "created_at": "2026-09-14T13:32:17.294996+00:00",
    "updated_at": "2026-09-14T13:32:17.294996+00:00"
  },
  {
    "watchlist_id": "WL-VEH-000017",
    "registration_number": "MH33PQ2489",
    "normalized_registration_number": "MH33PQ2489",
    "category": "DEMO_STOLEN_VEHICLE",
    "priority": "LOW",
    "status": "ACTIVE",
    "entity_type": "vehicle",
    "source": "SYNTHETIC_DEMO",
    "synthetic": true,
    "description": "Synthetic demonstration record (Target: Non-Matching Control)",
    "notes": "Configured to demonstrate negative lookup case (unobserved vehicle)",
    "created_at": "2026-09-14T13:32:17.294996+00:00",
    "updated_at": "2026-09-14T13:32:17.294996+00:00"
  },
  {
    "watchlist_id": "WL-VEH-000018",
    "registration_number": "MH11ZZ7916",